{
  "$schema": "openops://11_marketing_growth_agent/14_registry/repo_skills_registry.schema.json",
  "schemaVersion": "1.0.0",
  "generatedAt": "2026-01-24T17:35:01.675Z",
  "skillsRoot": "skills",
  "totalSkills": 236,
  "skills": [
    {
      "skillId": "3d-web-experience",
      "dirName": "3d-web-experience",
      "title": "3D Web Experience",
      "description": "Expert in building 3D experiences for the web - Three.js, React Three Fiber, Spline, WebGL, and interactive 3D scenes. Covers product configurators, 3D portfolios, immersive websites, and bringing depth to web experiences. Use when: 3D website, three.js, WebGL, react three fiber, 3D experience.",
      "path": "skills/3d-web-experience",
      "skillFile": "skills/3d-web-experience/SKILL.md",
      "hasSkillFile": true,
      "fileMeta": {
        "bytes": 5445,
        "mtimeISO": "2026-01-24T09:34:58.674Z"
      }
    },
    {
      "skillId": "ab-test-setup",
      "dirName": "ab-test-setup",
      "title": "A/B Test Setup",
      "description": "When the user wants to plan, design, or implement an A/B test or experiment. Also use when the user mentions \"A/B test,\" \"split test,\" \"experiment,\" \"test this change,\" \"variant copy,\" \"multivariate test,\" or \"hypothesis.\" For tracking implementation, see analytics-tracking.",
      "path": "skills/ab-test-setup",
      "skillFile": "skills/ab-test-setup/SKILL.md",
      "hasSkillFile": true,
      "fileMeta": {
        "bytes": 11172,
        "mtimeISO": "2026-01-24T09:34:59.128Z"
      }
    },
    {
      "skillId": "Active Directory Attacks",
      "dirName": "Active Directory Attacks",
      "title": "Active Directory Attacks",
      "description": "This skill should be used when the user asks to \"attack Active Directory\", \"exploit AD\", \"Kerberoasting\", \"DCSync\", \"pass-the-hash\", \"BloodHound enumeration\", \"Golden Ticket\", \"Silver Ticket\", \"AS-REP roasting\", \"NTLM relay\", or needs guidance on Windows domain penetration testing.",
      "path": "skills/Active Directory Attacks",
      "skillFile": "skills/Active Directory Attacks/SKILL.md",
      "hasSkillFile": true,
      "fileMeta": {
        "bytes": 9504,
        "mtimeISO": "2026-01-24T09:34:58.692Z"
      }
    },
    {
      "skillId": "address-github-comments",
      "dirName": "address-github-comments",
      "title": "Address GitHub Comments",
      "description": "Use when you need to address review or issue comments on an open GitHub Pull Request using the gh CLI.",
      "path": "skills/address-github-comments",
      "skillFile": "skills/address-github-comments/SKILL.md",
      "hasSkillFile": true,
      "fileMeta": {
        "bytes": 1227,
        "mtimeISO": "2026-01-24T09:34:59.131Z"
      }
    },
    {
      "skillId": "agent-evaluation",
      "dirName": "agent-evaluation",
      "title": "Agent Evaluation",
      "description": "Testing and benchmarking LLM agents including behavioral testing, capability assessment, reliability metrics, and production monitoring—where even top agents achieve less than 50% on real-world benchmarks Use when: agent testing, agent evaluation, benchmark agents, agent reliability, test agent.",
      "path": "skills/agent-evaluation",
      "skillFile": "skills/agent-evaluation/SKILL.md",
      "hasSkillFile": true,
      "fileMeta": {
        "bytes": 2089,
        "mtimeISO": "2026-01-24T09:34:59.133Z"
      }
    },
    {
      "skillId": "agent-manager-skill",
      "dirName": "agent-manager-skill",
      "title": "Agent Manager Skill",
      "description": "Manage multiple local CLI agents via tmux sessions (start/stop/monitor/assign) with cron-friendly scheduling.",
      "path": "skills/agent-manager-skill",
      "skillFile": "skills/agent-manager-skill/SKILL.md",
      "hasSkillFile": true,
      "fileMeta": {
        "bytes": 1054,
        "mtimeISO": "2026-01-24T09:34:59.135Z"
      }
    },
    {
      "skillId": "agent-memory-mcp",
      "dirName": "agent-memory-mcp",
      "title": "Agent Memory Skill",
      "description": "A hybrid memory system that provides persistent, searchable knowledge management for AI agents (Architecture, Patterns, Decisions).",
      "path": "skills/agent-memory-mcp",
      "skillFile": "skills/agent-memory-mcp/SKILL.md",
      "hasSkillFile": true,
      "fileMeta": {
        "bytes": 2101,
        "mtimeISO": "2026-01-24T09:34:59.139Z"
      }
    },
    {
      "skillId": "agent-memory-systems",
      "dirName": "agent-memory-systems",
      "title": "Agent Memory Systems",
      "description": "Memory is the cornerstone of intelligent agents. Without it, every interaction starts from zero. This skill covers the architecture of agent memory: short-term (context window), long-term (vector stores), and the cognitive architectures that organize them.  Key insight: Memory isn't just storage - it's retrieval. A million stored facts mean nothing if you can't find the right one. Chunking, embedding, and retrieval strategies determine whether your agent remembers or forgets.  The field is fragm",
      "path": "skills/agent-memory-systems",
      "skillFile": "skills/agent-memory-systems/SKILL.md",
      "hasSkillFile": true,
      "fileMeta": {
        "bytes": 2317,
        "mtimeISO": "2026-01-24T09:34:59.140Z"
      }
    },
    {
      "skillId": "agent-tool-builder",
      "dirName": "agent-tool-builder",
      "title": "Agent Tool Builder",
      "description": "Tools are how AI agents interact with the world. A well-designed tool is the difference between an agent that works and one that hallucinates, fails silently, or costs 10x more tokens than necessary.  This skill covers tool design from schema to error handling. JSON Schema best practices, description writing that actually helps the LLM, validation, and the emerging MCP standard that's becoming the lingua franca for AI tools.  Key insight: Tool descriptions are more important than tool implementa",
      "path": "skills/agent-tool-builder",
      "skillFile": "skills/agent-tool-builder/SKILL.md",
      "hasSkillFile": true,
      "fileMeta": {
        "bytes": 1673,
        "mtimeISO": "2026-01-24T09:34:59.149Z"
      }
    },
    {
      "skillId": "ai-agents-architect",
      "dirName": "ai-agents-architect",
      "title": "AI Agents Architect",
      "description": "Expert in designing and building autonomous AI agents. Masters tool use, memory systems, planning strategies, and multi-agent orchestration. Use when: build agent, AI agent, autonomous agent, tool use, function calling.",
      "path": "skills/ai-agents-architect",
      "skillFile": "skills/ai-agents-architect/SKILL.md",
      "hasSkillFile": true,
      "fileMeta": {
        "bytes": 2571,
        "mtimeISO": "2026-01-24T09:34:59.160Z"
      }
    },
    {
      "skillId": "ai-product",
      "dirName": "ai-product",
      "title": "AI Product Development",
      "description": "Every product will be AI-powered. The question is whether you'll build it right or ship a demo that falls apart in production.  This skill covers LLM integration patterns, RAG architecture, prompt engineering that scales, AI UX that users trust, and cost optimization that doesn't bankrupt you. Use when: keywords, file_patterns, code_patterns.",
      "path": "skills/ai-product",
      "skillFile": "skills/ai-product/SKILL.md",
      "hasSkillFile": true,
      "fileMeta": {
        "bytes": 2170,
        "mtimeISO": "2026-01-24T09:34:59.173Z"
      }
    },
    {
      "skillId": "ai-wrapper-product",
      "dirName": "ai-wrapper-product",
      "title": "AI Wrapper Product",
      "description": "Expert in building products that wrap AI APIs (OpenAI, Anthropic, etc.) into focused tools people will pay for. Not just 'ChatGPT but different' - products that solve specific problems with AI. Covers prompt engineering for products, cost management, rate limiting, and building defensible AI businesses. Use when: AI wrapper, GPT product, AI tool, wrap AI, AI SaaS.",
      "path": "skills/ai-wrapper-product",
      "skillFile": "skills/ai-wrapper-product/SKILL.md",
      "hasSkillFile": true,
      "fileMeta": {
        "bytes": 6623,
        "mtimeISO": "2026-01-24T09:34:59.195Z"
      }
    },
    {
      "skillId": "algolia-search",
      "dirName": "algolia-search",
      "title": "Algolia Search Integration",
      "description": "Expert patterns for Algolia search implementation, indexing strategies, React InstantSearch, and relevance tuning Use when: adding search to, algolia, instantsearch, search api, search functionality.",
      "path": "skills/algolia-search",
      "skillFile": "skills/algolia-search/SKILL.md",
      "hasSkillFile": true,
      "fileMeta": {
        "bytes": 1971,
        "mtimeISO": "2026-01-24T09:34:59.198Z"
      }
    },
    {
      "skillId": "algorithmic-art",
      "dirName": "algorithmic-art",
      "title": null,
      "description": "Creating algorithmic art using p5.js with seeded randomness and interactive parameter exploration. Use this when users request creating art using code, generative art, algorithmic art, flow fields, or particle systems. Create original algorithmic art rather than copying existing artists' work to avoid copyright violations.",
      "path": "skills/algorithmic-art",
      "skillFile": "skills/algorithmic-art/SKILL.md",
      "hasSkillFile": true,
      "fileMeta": {
        "bytes": 19769,
        "mtimeISO": "2026-01-24T09:34:59.207Z"
      }
    },
    {
      "skillId": "analytics-tracking",
      "dirName": "analytics-tracking",
      "title": "Analytics Tracking",
      "description": "When the user wants to set up, improve, or audit analytics tracking and measurement. Also use when the user mentions \"set up tracking,\" \"GA4,\" \"Google Analytics,\" \"conversion tracking,\" \"event tracking,\" \"UTM parameters,\" \"tag manager,\" \"GTM,\" \"analytics implementation,\" or \"tracking plan.\" For A/B test measurement, see ab-test-setup.",